{
  "id": "td11.validate.undefined-combo-security-reference",
  "revision": "1.0.0",
  "claim": {
    "id": "w3c.wot.td11.combo-security-reference",
    "revision": "1.0.0",
    "operation": "thing_description.validate",
    "evidence_profile": "value",
    "standard": {
      "identifier": "w3c.wot.thing-description",
      "revision": "2023-12-05",
      "source": "https://www.w3.org/TR/2023/REC-wot-thing-description11-20231205/",
      "section": "6.3.4.3"
    },
    "assertions": ["undefined_combo_security_reference_rejected"],
    "tags": ["thing-description-1.1"]
  },
  "input": {
    "document": {
      "@context": "https://www.w3.org/2022/wot/td/v1.1",
      "id": "urn:example:thing:undefined-combo-security",
      "title": "Undefined Combo Security Thing",
      "securityDefinitions": {
        "nosec_sc": {"scheme": "nosec"},
        "combo_sc": {
          "scheme": "combo",
          "oneOf": ["nosec_sc", "missing_sc"]
        }
      },
      "security": ["combo_sc"]
    }
  },
  "expectation": {
    "operator": "exact",
    "value": {"accepted": false, "code": "undefined_security_reference"}
  },
  "provenance": {
    "source": "https://www.w3.org/TR/2023/REC-wot-thing-description11-20231205/",
    "observed": "2026-09-05",
    "classification": "project_authored_synthetic_vector",
    "standard_section": "6.3.4.3"
  },
  "tags": ["combo-security", "negative", "security", "thing-description-1.1"],
  "digest": "sha256:db4d5de9822a6f87fa15fd7099a5697ea08716770bc8018d8e68456797d242ca"
}
