{
  "id": "td11.parse.minimal",
  "revision": "1.0.0",
  "claim": {
    "id": "w3c.wot.td11.parse",
    "revision": "1.0.0",
    "operation": "thing_description.parse",
    "evidence_profile": "value",
    "standard": {
      "identifier": "w3c.wot.thing-description",
      "revision": "2023-12-05",
      "source": "https://www.w3.org/TR/2023/REC-wot-thing-description11-20231205/",
      "section": "5.3.1"
    },
    "assertions": ["context_recognized", "required_title_preserved"],
    "tags": ["thing-description-1.1"]
  },
  "input": {
    "document": {
      "@context": "https://www.w3.org/2022/wot/td/v1.1",
      "id": "urn:example:thing:minimal",
      "title": "Minimal Thing",
      "securityDefinitions": {
        "no_security": {"scheme": "nosec"}
      },
      "security": ["no_security"]
    }
  },
  "expectation": {
    "operator": "exact",
    "value": {
      "accepted": true,
      "context": "https://www.w3.org/2022/wot/td/v1.1",
      "id": "urn:example:thing:minimal",
      "title": "Minimal Thing"
    }
  },
  "provenance": {
    "source": "https://www.w3.org/TR/2023/REC-wot-thing-description11-20231205/",
    "observed": "2026-09-02",
    "classification": "project_authored_synthetic_vector",
    "standard_section": "5.3.1"
  },
  "tags": ["positive", "thing-description-1.1"],
  "digest": "sha256:d10214474ebeeca0ab204570a54c0d523a60ac2dc68724062dde988a33a3dcaa"
}
