{
  "id": "td11.parse.extension-preservation",
  "revision": "1.0.0",
  "claim": {
    "id": "w3c.wot.td11.extension-preservation",
    "revision": "1.0.0",
    "operation": "thing_description.parse",
    "evidence_profile": "value",
    "standard": {
      "identifier": "w3c.wot.thing-description",
      "revision": "2023-12-05",
      "source": "https://www.w3.org/TR/2023/REC-wot-thing-description11-20231205/",
      "section": "6"
    },
    "assertions": ["extension_member_preserved"],
    "tags": ["thing-description-1.1"]
  },
  "input": {
    "document": {
      "@context": [
        "https://www.w3.org/2022/wot/td/v1.1",
        {"example": "https://example.org/wot#"}
      ],
      "id": "urn:example:thing:extension",
      "title": "Extension Thing",
      "securityDefinitions": {
        "no_security": {"scheme": "nosec"}
      },
      "security": ["no_security"],
      "example:profile": "synthetic"
    }
  },
  "expectation": {
    "operator": "exact",
    "value": {
      "accepted": true,
      "extension": {
        "example:profile": "synthetic"
      }
    }
  },
  "provenance": {
    "source": "https://www.w3.org/TR/2023/REC-wot-thing-description11-20231205/",
    "observed": "2026-09-02",
    "classification": "project_authored_synthetic_vector",
    "standard_section": "6"
  },
  "tags": ["extension", "positive", "thing-description-1.1"],
  "digest": "sha256:0bc0671a02b172cc2c4747a022f9d3f1fd7542fbf6596d57d38b175d39d22bbb"
}
