{
  "id": "td11.parse.property-form",
  "revision": "1.0.0",
  "claim": {
    "id": "w3c.wot.td11.property-form",
    "revision": "1.0.0",
    "operation": "thing_description.parse",
    "evidence_profile": "value",
    "standard": {
      "identifier": "w3c.wot.thing-description",
      "revision": "2023-12-05",
      "source": "https://www.w3.org/TR/2023/REC-wot-thing-description11-20231205/",
      "section": "5.3.2.1"
    },
    "assertions": [
      "property_data_schema_and_form_preserved"
    ],
    "tags": [
      "thing-description-1.1"
    ]
  },
  "input": {
    "document": {
      "@context": "https://www.w3.org/2022/wot/td/v1.1",
      "id": "urn:example:thing:property-form",
      "title": "Property Form Thing",
      "securityDefinitions": {
        "nosec_sc": {
          "scheme": "nosec"
        }
      },
      "security": [
        "nosec_sc"
      ],
      "properties": {
        "temperature": {
          "type": "number",
          "unit": "Cel",
          "readOnly": true,
          "forms": [
            {
              "href": "https://example.test/properties/temperature",
              "contentType": "application/json",
              "op": [
                "readproperty"
              ]
            }
          ]
        }
      }
    },
    "projection": [
      "/properties/temperature"
    ]
  },
  "expectation": {
    "operator": "exact",
    "value": {
      "accepted": true,
      "document": {
        "/properties/temperature": {
          "type": "number",
          "unit": "Cel",
          "readOnly": true,
          "forms": [
            {
              "href": "https://example.test/properties/temperature",
              "contentType": "application/json",
              "op": [
                "readproperty"
              ]
            }
          ]
        }
      }
    }
  },
  "provenance": {
    "source": "https://www.w3.org/TR/2023/REC-wot-thing-description11-20231205/",
    "observed": "2026-09-05",
    "classification": "project_authored_synthetic_vector",
    "standard_section": "5.3.2.1"
  },
  "tags": [
    "form",
    "positive",
    "property",
    "thing-description-1.1"
  ],
  "digest": "sha256:cf41bb79c9c4d2a34fbc7e53024ea9f9f97719d26d2cbc77b2635ac458f92cdc"
}
