{
  "id": "td11.validate.undefined-form-security-reference",
  "revision": "1.0.0",
  "claim": {
    "id": "w3c.wot.td11.form-security-reference",
    "revision": "1.0.0",
    "operation": "thing_description.validate",
    "evidence_profile": "value",
    "standard": {
      "identifier": "w3c.wot.thing-description",
      "revision": "2023-12-05",
      "source": "https://www.w3.org/TR/2023/REC-wot-thing-description11-20231205/",
      "section": "6.3.4.2"
    },
    "assertions": ["undefined_form_security_reference_rejected"],
    "tags": ["thing-description-1.1"]
  },
  "input": {
    "document": {
      "@context": "https://www.w3.org/2022/wot/td/v1.1",
      "id": "urn:example:thing:undefined-form-security",
      "title": "Undefined Form Security Thing",
      "securityDefinitions": {"nosec_sc": {"scheme": "nosec"}},
      "security": ["nosec_sc"],
      "properties": {
        "level": {
          "type": "number",
          "forms": [
            {
              "href": "https://example.test/properties/level",
              "op": ["readproperty"],
              "security": ["missing_sc"]
            }
          ]
        }
      }
    }
  },
  "expectation": {
    "operator": "exact",
    "value": {"accepted": false, "code": "undefined_security_reference"}
  },
  "provenance": {
    "source": "https://www.w3.org/TR/2023/REC-wot-thing-description11-20231205/",
    "observed": "2026-09-05",
    "classification": "project_authored_synthetic_vector",
    "standard_section": "6.3.4.2"
  },
  "tags": ["form", "negative", "security", "thing-description-1.1"],
  "digest": "sha256:85781e6145820d5c21bf3548f6450d1ac5f9a9efe083103b9e37160746d29966"
}
