{
  "id": "td11.parse.event-data",
  "revision": "1.0.0",
  "claim": {
    "id": "w3c.wot.td11.event-data",
    "revision": "1.0.0",
    "operation": "thing_description.parse",
    "evidence_profile": "value",
    "standard": {
      "identifier": "w3c.wot.thing-description",
      "revision": "2023-12-05",
      "source": "https://www.w3.org/TR/2023/REC-wot-thing-description11-20231205/",
      "section": "5.3.2.3"
    },
    "assertions": ["event_data_and_form_preserved"],
    "tags": ["thing-description-1.1"]
  },
  "input": {
    "document": {
      "@context": "https://www.w3.org/2022/wot/td/v1.1",
      "id": "urn:example:thing:event",
      "title": "Event Thing",
      "securityDefinitions": {"nosec_sc": {"scheme": "nosec"}},
      "security": ["nosec_sc"],
      "events": {
        "alarm": {
          "data": {
            "type": "object",
            "properties": {
              "severity": {"type": "integer"},
              "message": {"type": "string"}
            }
          },
          "forms": [
            {"href": "https://example.test/events/alarm", "op": ["subscribeevent"]}
          ]
        }
      }
    }
  },
  "expectation": {
    "operator": "exact",
    "value": {
      "data": {
        "properties": {
          "message": {"type": "string"},
          "severity": {"type": "integer"}
        },
        "type": "object"
      },
      "forms": [
        {"href": "https://example.test/events/alarm", "op": ["subscribeevent"]}
      ],
      "name": "alarm"
    }
  },
  "provenance": {
    "source": "https://www.w3.org/TR/2023/REC-wot-thing-description11-20231205/",
    "observed": "2026-09-05",
    "classification": "project_authored_synthetic_vector",
    "standard_section": "5.3.2.3"
  },
  "tags": ["event", "form", "positive", "thing-description-1.1"],
  "digest": "sha256:5063dbb694bf794c9457c0be6ae0438a05f55dfc189a97c00a8f277c0de066d8"
}
