{
  "id": "td11.validate.misordered-context",
  "revision": "1.0.0",
  "claim": {
    "id": "w3c.wot.td11.context-order",
    "revision": "1.0.0",
    "operation": "thing_description.validate",
    "evidence_profile": "value",
    "standard": {
      "identifier": "w3c.wot.thing-description",
      "revision": "2023-12-05",
      "source": "https://www.w3.org/TR/2023/REC-wot-thing-description11-20231205/",
      "section": "5.3.1.1"
    },
    "assertions": [
      "misordered_td11_context_rejected"
    ],
    "tags": [
      "thing-description-1.1"
    ]
  },
  "input": {
    "document": {
      "@context": [
        "https://example.test/context",
        "https://www.w3.org/2022/wot/td/v1.1"
      ],
      "title": "Misordered context",
      "securityDefinitions": {
        "no_security": {
          "scheme": "nosec"
        }
      },
      "security": [
        "no_security"
      ]
    },
    "projection": [
      "/@context"
    ]
  },
  "expectation": {
    "operator": "exact",
    "value": {
      "accepted": false,
      "errors": [
        {
          "code": "unsupported_context",
          "phase": "semantic",
          "path": "/@context"
        }
      ]
    }
  },
  "provenance": {
    "source": "https://www.w3.org/TR/2023/REC-wot-thing-description11-20231205/",
    "observed": "2026-09-14",
    "classification": "project_authored_synthetic_vector",
    "standard_section": "5.3.1.1"
  },
  "tags": [
    "negative",
    "thing-description-1.1"
  ],
  "digest": "sha256:614b578cd7f48305d6641838ccb836f61fe37063d8315fa3556df2f97fdc4a8e"
}
