{
  "id": "td11.parse.security-definition",
  "revision": "1.0.0",
  "claim": {
    "id": "w3c.wot.td11.security-definition",
    "revision": "1.0.0",
    "operation": "thing_description.parse",
    "evidence_profile": "value",
    "standard": {
      "identifier": "w3c.wot.thing-description",
      "revision": "2023-12-05",
      "source": "https://www.w3.org/TR/2023/REC-wot-thing-description11-20231205/",
      "section": "5.3.1"
    },
    "assertions": [
      "security_definition_and_selection_preserved"
    ],
    "tags": [
      "thing-description-1.1"
    ]
  },
  "input": {
    "document": {
      "@context": "https://www.w3.org/2022/wot/td/v1.1",
      "id": "urn:example:thing:secured",
      "title": "Secured Thing",
      "securityDefinitions": {
        "basic_sc": {
          "scheme": "basic",
          "in": "header"
        }
      },
      "security": [
        "basic_sc"
      ]
    },
    "projection": [
      "/security",
      "/securityDefinitions"
    ]
  },
  "expectation": {
    "operator": "exact",
    "value": {
      "accepted": true,
      "document": {
        "/security": [
          "basic_sc"
        ],
        "/securityDefinitions": {
          "basic_sc": {
            "scheme": "basic",
            "in": "header"
          }
        }
      }
    }
  },
  "provenance": {
    "source": "https://www.w3.org/TR/2023/REC-wot-thing-description11-20231205/",
    "observed": "2026-09-05",
    "classification": "project_authored_synthetic_vector",
    "standard_section": "5.3.1"
  },
  "tags": [
    "positive",
    "security",
    "thing-description-1.1"
  ],
  "digest": "sha256:d26c39ca9122fb6ed76f5ee697ef510a997d5c74f117df38563fd1d5fde587bc"
}
