{
  "id": "td11.parse.affordance-categories",
  "revision": "1.0.0",
  "claim": {
    "id": "w3c.wot.td11.affordance-categories",
    "revision": "1.0.0",
    "operation": "thing_description.parse",
    "evidence_profile": "value",
    "standard": {
      "identifier": "w3c.wot.thing-description",
      "revision": "2023-12-05",
      "source": "https://www.w3.org/TR/2023/REC-wot-thing-description11-20231205/",
      "section": "5.3.2"
    },
    "assertions": [
      "action_affordance_recognized",
      "event_affordance_recognized",
      "property_affordance_recognized"
    ],
    "tags": [
      "thing-description-1.1"
    ]
  },
  "input": {
    "document": {
      "@context": "https://www.w3.org/2022/wot/td/v1.1",
      "id": "urn:example:thing:affordances",
      "title": "Affordance Thing",
      "securityDefinitions": {
        "no_security": {
          "scheme": "nosec"
        }
      },
      "security": [
        "no_security"
      ],
      "properties": {
        "level": {
          "type": "integer",
          "readOnly": true,
          "forms": [
            {
              "href": "https://example.com/things/affordances/properties/level",
              "op": "readproperty"
            }
          ]
        }
      },
      "actions": {
        "reset": {
          "forms": [
            {
              "href": "https://example.com/things/affordances/actions/reset",
              "op": "invokeaction"
            }
          ]
        }
      },
      "events": {
        "changed": {
          "data": {
            "type": "integer"
          },
          "forms": [
            {
              "href": "https://example.com/things/affordances/events/changed",
              "op": "subscribeevent"
            }
          ]
        }
      }
    },
    "projection": [
      "/properties/level",
      "/actions/reset",
      "/events/changed"
    ]
  },
  "expectation": {
    "operator": "exact",
    "value": {
      "accepted": true,
      "document": {
        "/actions/reset": {
          "forms": [
            {
              "href": "https://example.com/things/affordances/actions/reset",
              "op": "invokeaction"
            }
          ]
        },
        "/events/changed": {
          "data": {
            "type": "integer"
          },
          "forms": [
            {
              "href": "https://example.com/things/affordances/events/changed",
              "op": "subscribeevent"
            }
          ]
        },
        "/properties/level": {
          "type": "integer",
          "readOnly": true,
          "forms": [
            {
              "href": "https://example.com/things/affordances/properties/level",
              "op": "readproperty"
            }
          ]
        }
      }
    }
  },
  "provenance": {
    "source": "https://www.w3.org/TR/2023/REC-wot-thing-description11-20231205/",
    "observed": "2026-09-02",
    "classification": "project_authored_synthetic_vector",
    "standard_section": "5.3.2"
  },
  "tags": [
    "interaction-affordance",
    "positive",
    "thing-description-1.1"
  ],
  "digest": "sha256:ef27ea05d20f8410bcda900d1feba65fbc91d9fa2fe1b06e712c0804e3390bbc"
}
