{
  "id": "td11.validate.missing-title",
  "revision": "1.0.0",
  "claim": {
    "id": "w3c.wot.td11.required-title",
    "revision": "1.0.0",
    "operation": "thing_description.validate",
    "evidence_profile": "value",
    "standard": {
      "identifier": "w3c.wot.thing-description",
      "revision": "2023-12-05",
      "source": "https://www.w3.org/TR/2023/REC-wot-thing-description11-20231205/",
      "section": "5.3.1"
    },
    "assertions": ["missing_required_title_rejected"],
    "tags": ["thing-description-1.1"]
  },
  "input": {
    "document": {
      "@context": "https://www.w3.org/2022/wot/td/v1.1",
      "id": "urn:example:thing:missing-title",
      "securityDefinitions": {
        "no_security": {"scheme": "nosec"}
      },
      "security": ["no_security"]
    }
  },
  "expectation": {
    "operator": "exact",
    "value": {
      "accepted": false,
      "code": "missing_required_title"
    }
  },
  "provenance": {
    "source": "https://www.w3.org/TR/2023/REC-wot-thing-description11-20231205/",
    "observed": "2026-09-02",
    "classification": "project_authored_synthetic_vector",
    "standard_section": "5.3.1"
  },
  "tags": ["negative", "thing-description-1.1"],
  "digest": "sha256:dec2b4e9e55b3ce6cf58c30e5251fa40539cd4054f5f8aaed4a3690ff94705ac"
}
