{
  "id": "td11.parse.action-input-output",
  "revision": "1.0.0",
  "claim": {
    "id": "w3c.wot.td11.action-input-output",
    "revision": "1.0.0",
    "operation": "thing_description.parse",
    "evidence_profile": "value",
    "standard": {
      "identifier": "w3c.wot.thing-description",
      "revision": "2023-12-05",
      "source": "https://www.w3.org/TR/2023/REC-wot-thing-description11-20231205/",
      "section": "5.3.2.2"
    },
    "assertions": ["action_input_output_and_form_preserved"],
    "tags": ["thing-description-1.1"]
  },
  "input": {
    "document": {
      "@context": "https://www.w3.org/2022/wot/td/v1.1",
      "id": "urn:example:thing:action",
      "title": "Action Thing",
      "securityDefinitions": {"nosec_sc": {"scheme": "nosec"}},
      "security": ["nosec_sc"],
      "actions": {
        "setLevel": {
          "input": {"type": "integer", "minimum": 0, "maximum": 100},
          "output": {"type": "boolean"},
          "safe": false,
          "idempotent": true,
          "forms": [
            {"href": "https://example.test/actions/setLevel", "op": ["invokeaction"]}
          ]
        }
      }
    }
  },
  "expectation": {
    "operator": "exact",
    "value": {
      "forms": [
        {"href": "https://example.test/actions/setLevel", "op": ["invokeaction"]}
      ],
      "idempotent": true,
      "input": {"maximum": 100, "minimum": 0, "type": "integer"},
      "name": "setLevel",
      "output": {"type": "boolean"},
      "safe": false
    }
  },
  "provenance": {
    "source": "https://www.w3.org/TR/2023/REC-wot-thing-description11-20231205/",
    "observed": "2026-09-05",
    "classification": "project_authored_synthetic_vector",
    "standard_section": "5.3.2.2"
  },
  "tags": ["action", "form", "positive", "thing-description-1.1"],
  "digest": "sha256:6c8dea7d869274701f62428407abb8cfbd8584f61caceb832a19e42b866cb4a9"
}
